{
  "name": "lpis",
  "display_name": "Live Patient Implant Surgery Mini-Residency",
  "colors": {
    "primary": "#0a3d62",
    "primary_dark": "#1a4d72",
    "secondary": "#1d7d8e",
    "cta_bg": "#0a3d62",
    "cta_text": "#ffffff",
    "body_text": "#222222",
    "body_text_dark": "#eaeaea",
    "bg": "#f5f5f5",
    "bg_dark": "#121212",
    "card_bg": "#ffffff",
    "card_bg_dark": "#1e1e1e",
    "muted": "#888888",
    "accent": "#c7a200"
  },
  "fonts": {
    "body": "-apple-system, BlinkMacSystemFont, 'Segoe UI', Roboto, Helvetica, Arial, sans-serif",
    "headings": "-apple-system, BlinkMacSystemFont, 'Segoe UI', Roboto, Helvetica, Arial, sans-serif"
  },
  "branding": {
    "banner_url": "https://content.app-us1.com/LMez9/2026/04/28/3a23406d-1b41-443d-a826-037cb3e0309a.jpeg",
    "banner_urls": [
      "https://content.app-us1.com/LMez9/2026/04/28/3a23406d-1b41-443d-a826-037cb3e0309a.jpeg",
      "https://content.app-us1.com/LMez9/2026/04/28/c5dc3199-bb97-4588-a36b-8513b1fcdc9d.jpeg",
      "https://content.app-us1.com/LMez9/2026/04/28/903d0301-4afb-4d27-9556-00d8b9e431e7.jpeg"
    ],
    "banner_alt": "Live Patient Implant Surgery Mini-Residency - Wellington",
    "banner_width_px": 600,
    "banner_height_px": 180
  },
  "urls": {
    "sales_page": "https://instituteofdigitaldentistry.com/live-courses/live-patient-implant-surgery-course-wellington-new-zealand/?cid=%CONTACTID%",
    "not_interested": "https://instituteofdigitaldentistry.com/not-interested/?cid=%CONTACTID%"
  },
  "cta_patterns": [
    "Register now",
    "Reserve your spot",
    "Apply for the residency",
    "Hold my seat",
    "Yes, count me in",
    "Book the call",
    "Continue to checkout",
    "Tell me more"
  ],
  "tags": {
    "interest": "INTEREST: LPIS 2026 - Engaged",
    "not_interested": "NOT INTERESTED: LPIS 2026"
  }
}
