{
  "name": "asimr",
  "display_name": "Advanced Surgical Implantology Mini-Residency",
  "colors": {
    "primary": "#7a1c1c",
    "primary_dark": "#5d1010",
    "secondary": "#1d7d8e",
    "cta_bg": "#7a1c1c",
    "cta_text": "#ffffff",
    "body_text": "#222222",
    "body_text_dark": "#eaeaea",
    "bg": "#f5f5f5",
    "bg_dark": "#121212",
    "card_bg": "#ffffff",
    "card_bg_dark": "#1e1e1e",
    "muted": "#888888",
    "accent": "#c7a200"
  },
  "fonts": {
    "body": "-apple-system, BlinkMacSystemFont, 'Segoe UI', Roboto, Helvetica, Arial, sans-serif",
    "headings": "-apple-system, BlinkMacSystemFont, 'Segoe UI', Roboto, Helvetica, Arial, sans-serif"
  },
  "branding": {
    "banner_url": "https://content.app-us1.com/LMez9/2026/04/28/f619246d-f28c-4577-9799-4ebdd048d615.jpeg",
    "banner_urls": [
      "https://content.app-us1.com/LMez9/2026/04/28/f619246d-f28c-4577-9799-4ebdd048d615.jpeg",
      "https://content.app-us1.com/LMez9/2026/04/28/fb64694f-9ba4-46f2-bbac-9127f25ad9c3.jpeg",
      "https://content.app-us1.com/LMez9/2026/04/28/00e46f10-d048-439b-9322-5a166c834726.jpeg"
    ],
    "banner_alt": "Advanced Surgical Implantology Mini-Residency - Online",
    "banner_width_px": 600,
    "banner_height_px": 180
  },
  "urls": {
    "sales_page": "https://instituteofdigitaldentistry.com/bundles/advanced-surgical-implantology-mini-residency/?cid=%CONTACTID%",
    "not_interested": "https://instituteofdigitaldentistry.com/not-interested/?cid=%CONTACTID%"
  },
  "cta_patterns": [
    "Get instant access",
    "Enrol now",
    "Yes, I want this",
    "Continue to checkout",
    "Tell me more",
    "Book the call"
  ],
  "tags": {
    "interest": "INTEREST: ASIMR - Engaged",
    "not_interested": "NOT INTERESTED: ASIMR"
  }
}
